{
  "aggregates": {
    "anchored_forward|h10": {
      "classwise_f1_mean": [
        0.16260503433948315,
        0.7785370738379572,
        0.1582701588152721
      ],
      "classwise_precision_mean": [
        0.22881421700016358,
        0.67177747756731,
        0.2461034157699094
      ],
      "classwise_recall_mean": [
        0.12958825339676866,
        0.9385943180368613,
        0.1284826914532586
      ],
      "confusion_matrix_summed": [
        [
          40363,
          258230,
          19822
        ],
        [
          32650,
          1072051,
          33024
        ],
        [
          20997,
          254322,
          38211
        ]
      ],
      "count": 45,
      "expected_folds": [
        1,
        2,
        3,
        4,
        5,
        6,
        7,
        8,
        9
      ],
      "expected_seeds": [
        1337,
        2027,
        31415,
        424242,
        8675309
      ],
      "folds": [
        1,
        2,
        3,
        4,
        5,
        6,
        7,
        8,
        9
      ],
      "max_training_seconds": 9050.939586200053,
      "mean_accuracy": 0.6408106835271897,
      "mean_balanced_accuracy": 0.3988884209622964,
      "mean_brier": 0.5161686706329555,
      "mean_ece": 0.07230194425515533,
      "mean_inference_ms_per_sample": 0.11811934227269497,
      "mean_macro_f1": 0.36647075566423737,
      "mean_mcc": 0.133925805549909,
      "mean_nll": 0.9745964327459747,
      "mean_sample_count": 39326.0,
      "mean_training_seconds": 2239.8418211155517,
      "min_training_seconds": 100.24308200000087,
      "seeds": [
        1337,
        2027,
        31415,
        424242,
        8675309
      ],
      "std_accuracy": 0.08367113275728534,
      "std_balanced_accuracy": 0.09291468110042357,
      "std_brier": 0.11929324301897311,
      "std_ece": 0.06524869754394665,
      "std_macro_f1": 0.13510327483336365,
      "std_mcc": 0.18025775140187775,
      "std_nll": 0.3698575392090319,
      "total_sample_count": 1769670
    },
    "anchored_forward|h100": {
      "classwise_f1_mean": [
        0.5005011656727925,
        0.4511431495921784,
        0.4865812215901099
      ],
      "classwise_precision_mean": [
        0.47947527790701,
        0.5327027656187387,
        0.47523954677315966
      ],
      "classwise_recall_mean": [
        0.5268887025290014,
        0.4054172215168958,
        0.5022827659335074
      ],
      "confusion_matrix_summed": [
        [
          356639,
          64507,
          254239
        ],
        [
          123814,
          206603,
          112033
        ],
        [
          268150,
          56944,
          326741
        ]
      ],
      "count": 45,
      "expected_folds": [
        1,
        2,
        3,
        4,
        5,
        6,
        7,
        8,
        9
      ],
      "expected_seeds": [
        1337,
        2027,
        31415,
        424242,
        8675309
      ],
      "folds": [
        1,
        2,
        3,
        4,
        5,
        6,
        7,
        8,
        9
      ],
      "max_training_seconds": 4376.721088799997,
      "mean_accuracy": 0.4961097316032692,
      "mean_balanced_accuracy": 0.47819622999313477,
      "mean_brier": 0.6224535746253541,
      "mean_ece": 0.11716419361869705,
      "mean_inference_ms_per_sample": 0.11720135851204934,
      "mean_macro_f1": 0.479408512285027,
      "mean_mcc": 0.20441329648038326,
      "mean_nll": 1.0892063382199073,
      "mean_sample_count": 39326.0,
      "mean_training_seconds": 1956.2685299377792,
      "min_training_seconds": 150.65779079998902,
      "seeds": [
        1337,
        2027,
        31415,
        424242,
        8675309
      ],
      "std_accuracy": 0.07649708915700622,
      "std_balanced_accuracy": 0.09461798870192027,
      "std_brier": 0.08965476566221674,
      "std_ece": 0.06248439598816515,
      "std_macro_f1": 0.09620258472926393,
      "std_mcc": 0.1435867152169201,
      "std_nll": 0.20215325943410958,
      "total_sample_count": 1769670
    },
    "anchored_forward|h20": {
      "classwise_f1_mean": [
        0.19350750806018574,
        0.6597117325879889,
        0.18541766941048132
      ],
      "classwise_precision_mean": [
        0.28784636636562555,
        0.5633153874092968,
        0.29754075131949775
      ],
      "classwise_recall_mean": [
        0.15868876802680856,
        0.8156462516057735,
        0.14845807552177273
      ],
      "confusion_matrix_summed": [
        [
          63309,
          297475,
          49496
        ],
        [
          85681,
          791168,
          81101
        ],
        [
          53298,
          290396,
          57746
        ]
      ],
      "count": 45,
      "expected_folds": [
        1,
        2,
        3,
        4,
        5,
        6,
        7,
        8,
        9
      ],
      "expected_seeds": [
        1337,
        2027,
        31415,
        424242,
        8675309
      ],
      "folds": [
        1,
        2,
        3,
        4,
        5,
        6,
        7,
        8,
        9
      ],
      "max_training_seconds": 7237.034424999962,
      "mean_accuracy": 0.5063130616205437,
      "mean_balanced_accuracy": 0.3742643650514516,
      "mean_brier": 0.6561385195920983,
      "mean_ece": 0.11571981290447576,
      "mean_inference_ms_per_sample": 0.11546157263427366,
      "mean_macro_f1": 0.3462123033528854,
      "mean_mcc": 0.08990819315369743,
      "mean_nll": 1.2522453072190192,
      "mean_sample_count": 39326.0,
      "mean_training_seconds": 2545.693495579998,
      "min_training_seconds": 151.47553450000123,
      "seeds": [
        1337,
        2027,
        31415,
        424242,
        8675309
      ],
      "std_accuracy": 0.08744888909123688,
      "std_balanced_accuracy": 0.05204617210281824,
      "std_brier": 0.1179460264667772,
      "std_ece": 0.09372174236398764,
      "std_macro_f1": 0.08165765151710111,
      "std_mcc": 0.1023476144580641,
      "std_nll": 0.3780435747659715,
      "total_sample_count": 1769670
    },
    "anchored_forward|h30": {
      "classwise_f1_mean": [
        0.3201441821709651,
        0.596774477351458,
        0.3140061675566757
      ],
      "classwise_precision_mean": [
        0.3772354410324724,
        0.5401069186621014,
        0.364789440467163
      ],
      "classwise_recall_mean": [
        0.29559411730024904,
        0.683535389669932,
        0.2840752962971114
      ],
      "confusion_matrix_summed": [
        [
          138942,
          236824,
          98494
        ],
        [
          128951,
          586983,
          118466
        ],
        [
          102760,
          229792,
          128458
        ]
      ],
      "count": 45,
      "expected_folds": [
        1,
        2,
        3,
        4,
        5,
        6,
        7,
        8,
        9
      ],
      "expected_seeds": [
        1337,
        2027,
        31415,
        424242,
        8675309
      ],
      "folds": [
        1,
        2,
        3,
        4,
        5,
        6,
        7,
        8,
        9
      ],
      "max_training_seconds": 5413.594581699988,
      "mean_accuracy": 0.4717395651996614,
      "mean_balanced_accuracy": 0.4210682677557643,
      "mean_brier": 0.6551490219004994,
      "mean_ece": 0.10899146107106861,
      "mean_inference_ms_per_sample": 0.12182337351573069,
      "mean_macro_f1": 0.410308275693033,
      "mean_mcc": 0.1508558867870969,
      "mean_nll": 1.1792466712761815,
      "mean_sample_count": 39326.0,
      "mean_training_seconds": 2384.8027318088857,
      "min_training_seconds": 327.2525683999993,
      "seeds": [
        1337,
        2027,
        31415,
        424242,
        8675309
      ],
      "std_accuracy": 0.11118638055997893,
      "std_balanced_accuracy": 0.09280377270090008,
      "std_brier": 0.12185699303885296,
      "std_ece": 0.07620424154531327,
      "std_macro_f1": 0.10658251273176604,
      "std_mcc": 0.14947316114686796,
      "std_nll": 0.2724450441568594,
      "total_sample_count": 1769670
    },
    "anchored_forward|h50": {
      "classwise_f1_mean": [
        0.422191476324154,
        0.48039509778567285,
        0.41373575227438314
      ],
      "classwise_precision_mean": [
        0.41223317688544525,
        0.5136483757180305,
        0.4059688988297868
      ],
      "classwise_recall_mean": [
        0.43972597194889723,
        0.4578779930899167,
        0.4271915378625808
      ],
      "confusion_matrix_summed": [
        [
          246059,
          125534,
          190212
        ],
        [
          166594,
          341085,
          155891
        ],
        [
          193512,
          119032,
          231751
        ]
      ],
      "count": 45,
      "expected_folds": [
        1,
        2,
        3,
        4,
        5,
        6,
        7,
        8,
        9
      ],
      "expected_seeds": [
        1337,
        2027,
        31415,
        424242,
        8675309
      ],
      "folds": [
        1,
        2,
        3,
        4,
        5,
        6,
        7,
        8,
        9
      ],
      "max_training_seconds": 4882.530639400007,
      "mean_accuracy": 0.4517169178777037,
      "mean_balanced_accuracy": 0.44159850096713166,
      "mean_brier": 0.6611529249561231,
      "mean_ece": 0.11521167187705281,
      "mean_inference_ms_per_sample": 0.12267424163105785,
      "mean_macro_f1": 0.4387741087947366,
      "mean_mcc": 0.16885945796577292,
      "mean_nll": 1.1860534417254638,
      "mean_sample_count": 39326.0,
      "mean_training_seconds": 2379.272058711113,
      "min_training_seconds": 313.74790430000576,
      "seeds": [
        1337,
        2027,
        31415,
        424242,
        8675309
      ],
      "std_accuracy": 0.10954975850438813,
      "std_balanced_accuracy": 0.10015914343787996,
      "std_brier": 0.1203400068706026,
      "std_ece": 0.08078388362350516,